{
  "board": {
    "street": "flop",
    "cards": ["Ah", "Kd", "7s"]
  },
  "hero": {
    "position": "BTN",
    "holeCards": ["Ac", "Qh"],
    "stack": 85
  },
  "players": [
    {
      "position": "BB",
      "stack": 90,
      "label": "villain"
    }
  ],
  "effectiveStack": 85,
  "pot": {
    "size": 15,
    "currentBet": 10
  },
  "rangeMatrix": {
    "displayFor": "villain",
    "matrixLabels": {
      "rows": ["A", "K", "Q", "J", "T", "9", "8", "7", "6", "5", "4", "3", "2"],
      "columns": ["A", "K", "Q", "J", "T", "9", "8", "7", "6", "5", "4", "3", "2"]
    },
    "matrix": [
      [1.0, 0.8, 0.7, 0.6, 0.5, 0.3, 0.2, 0.1, 0.1, 0.1, 0.0, 0.0, 0.0],
      [0.5, 1.0, 0.75, 0.6, 0.5, 0.3, 0.2, 0.1, 0.0, 0.0, 0.0, 0.0, 0.0],
      [0.4, 0.5, 1.0, 0.7, 0.6, 0.4, 0.3, 0.2, 0.1, 0.0, 0.0, 0.0, 0.0],
      [0.3, 0.4, 0.5, 1.0, 0.65, 0.5, 0.4, 0.3, 0.2, 0.1, 0.0, 0.0, 0.0],
      [0.2, 0.3, 0.4, 0.5, 1.0, 0.6, 0.5, 0.4, 0.3, 0.2, 0.1, 0.0, 0.0],
      [0.1, 0.2, 0.3, 0.4, 0.5, 1.0, 0.65, 0.55, 0.45, 0.35, 0.25, 0.15, 0.1],
      [0.1, 0.1, 0.2, 0.3, 0.4, 0.5, 1.0, 0.7, 0.6, 0.5, 0.4, 0.3, 0.2],
      [0.0, 0.0, 0.1, 0.2, 0.3, 0.4, 0.5, 1.0, 0.75, 0.65, 0.55, 0.45, 0.35],
      [0.0, 0.0, 0.0, 0.1, 0.2, 0.3, 0.4, 0.6, 1.0, 0.8, 0.7, 0.6, 0.5],
      [0.0, 0.0, 0.0, 0.0, 0.1, 0.2, 0.3, 0.5, 0.7, 1.0, 0.85, 0.75, 0.65],
      [0.0, 0.0, 0.0, 0.0, 0.0, 0.1, 0.2, 0.4, 0.6, 0.75, 1.0, 0.9, 0.8],
      [0.0, 0.0, 0.0, 0.0, 0.0, 0.0, 0.1, 0.3, 0.5, 0.65, 0.8, 1.0, 0.9],
      [0.0, 0.0, 0.0, 0.0, 0.0, 0.0, 0.0, 0.2, 0.4, 0.55, 0.7, 0.85, 1.0]
    ],
    "colorScheme": "heatmap"
  },
  "actionHistory": [
    {
      "street": "preflop",
      "player": "hero",
      "action": "raise",
      "amount": 2.5
    },
    {
      "street": "preflop",
      "player": "villain",
      "action": "call",
      "amount": 2.5
    },
    {
      "street": "flop",
      "player": "villain",
      "action": "check"
    },
    {
      "street": "flop",
      "player": "hero",
      "action": "bet",
      "amount": 10
    }
  ],
  "metadata": {
    "title": "BTN vs BB: Top Pair Decision on Ace-High Board",
    "difficulty": "intermediate",
    "tags": ["continuation-bet", "top-pair", "position", "ace-high"]
  }
}
